[
  {
    "id": "cushing-primary-care-direct",
    "condition": "Cushing-Syndrom / Hyperkortisolismus",
    "conditionId": "cushing-syndrom-hyperkortisolismus",
    "setting": "Hausarztpraxis",
    "settingId": "hausarztpraxis",
    "evidenceLevel": "direct",
    "population": "Häufige metabolische Konstellation wie Adipositas, Diabetes oder Hypertonie ohne spezifische/progrediente Cushing-Zeichen.",
    "probability": 0.001,
    "rangeLow": 0.0005,
    "rangeHigh": 0.005,
    "rationale": "Sehr niedrige Prätestwahrscheinlichkeit bei unspezifischen metabolischen Befunden. Die Leitlinie empfiehlt kein breites Screening ohne diskriminative oder progrediente Merkmale.",
    "limitations": "Platzhalter für Primärversorgung; bei progredienten Zeichen, ungewöhnlichen Manifestationen für das Alter oder Nebenniereninzidentalom deutlich höher ansetzen.",
    "lastReviewed": "2026-05-17",
    "sources": [
      {
        "title": "Endocrine Society Guideline: Diagnosis of Cushing's Syndrome",
        "year": 2008,
        "url": "https://academic.oup.com/jcem/article/93/5/1526/2598096",
        "kind": "Leitlinie",
        "note": "Empfiehlt Testung bei multiplen/progredienten oder hoch diskriminativen Zeichen und rät von breitem Screening ab."
      }
    ],
    "kind": "curated",
    "reviewStatus": "needs-review",
    "evidenceQuality": "expert-opinion",
    "dataCompleteness": "partial",
    "reviewNote": "Aktualisiert aus bereitgestellten Setting-Annahmen und Quellenabgleich; lokale Übertragbarkeit weiter fachlich prüfen."
  },
  {
    "id": "cushing-endocrine-direct",
    "condition": "Cushing-Syndrom / Hyperkortisolismus",
    "conditionId": "cushing-syndrom-hyperkortisolismus",
    "setting": "Ambulant: Endokrinologie",
    "settingId": "ambulant-endokrinologie",
    "evidenceLevel": "direct",
    "population": "Überwiesene Patienten mit mehreren progredienten oder diskriminativen Cushing-Zeichen, z. B. proximale Myopathie, breite violette Striae, Plethora, Hämatomneigung oder unerklärte Osteoporose.",
    "probability": 0.05,
    "rangeLow": 0.02,
    "rangeHigh": 0.2,
    "rationale": "Gezielte endokrinologische Abklärung bei diskriminativen/progredienten Merkmalen. Der Zahlenwert bleibt eine konservative Arbeitsannahme, weil die konkrete Prätestwahrscheinlichkeit stark von Überweisungsselektion und Merkmalanzahl abhängt.",
    "limitations": "Nicht als populationsbasierte Prävalenz verwenden. Pseudo-Cushing-Konstellationen, Medikamente und Testbedingungen können die Aussagekraft stark beeinflussen.",
    "lastReviewed": "2026-05-17",
    "sources": [
      {
        "title": "Endocrine Society Guideline: Diagnosis of Cushing's Syndrome",
        "year": 2008,
        "url": "https://academic.oup.com/jcem/article/93/5/1526/2598096",
        "kind": "Leitlinie",
        "note": "Empfiehlt Testung bei multiplen/progredienten oder hoch diskriminativen Zeichen und rät von breitem Screening ab."
      },
      {
        "title": "Adrenal Hypercortisolism: Screening, Diagnosis, and Testing Modalities",
        "year": 2019,
        "url": "https://academic.oup.com/jes/article/3/5/1097/5436876",
        "kind": "Review",
        "note": "Review zu Screening-Indikationen und Prävalenz in selektierten metabolischen Risikogruppen."
      }
    ],
    "kind": "curated",
    "reviewStatus": "needs-review",
    "evidenceQuality": "expert-opinion",
    "dataCompleteness": "partial",
    "reviewNote": "Aktualisiert aus bereitgestellten Setting-Annahmen und Quellenabgleich; lokale Übertragbarkeit weiter fachlich prüfen."
  },
  {
    "id": "cushing-general-fallback",
    "condition": "Cushing-Syndrom / Hyperkortisolismus",
    "conditionId": "cushing-syndrom-hyperkortisolismus",
    "setting": "Allgemeine Erkrankungsannahme",
    "settingId": "general",
    "evidenceLevel": "fallback",
    "population": "Patienten mit klinischem Verdacht auf Hyperkortisolismus ohne spezifischere Setting-Daten.",
    "probability": 0.02,
    "rangeLow": 0.005,
    "rangeHigh": 0.1,
    "rationale": "Allgemeiner Fallback zwischen unspezifischer Primärversorgung und klar selektierter endokrinologischer Abklärung.",
    "limitations": "Bei nur unspezifischer Adipositas/Diabetes/Hypertonie niedriger; bei diskriminativen/progredienten Zeichen höher ansetzen.",
    "lastReviewed": "2026-05-17",
    "sources": [
      {
        "title": "Endocrine Society Guideline: Diagnosis of Cushing's Syndrome",
        "year": 2008,
        "url": "https://academic.oup.com/jcem/article/93/5/1526/2598096",
        "kind": "Leitlinie",
        "note": "Empfiehlt Testung bei multiplen/progredienten oder hoch diskriminativen Zeichen und rät von breitem Screening ab."
      }
    ],
    "kind": "curated",
    "reviewStatus": "needs-review",
    "evidenceQuality": "expert-opinion",
    "dataCompleteness": "partial",
    "reviewNote": "Aktualisiert aus bereitgestellten Setting-Annahmen und Quellenabgleich; lokale Übertragbarkeit weiter fachlich prüfen."
  },
  {
    "id": "pa-nephrology-direct",
    "condition": "Primärer Hyperaldosteronismus",
    "conditionId": "primarer-hyperaldosteronismus",
    "setting": "Ambulant: Nephrologie / Hypertonie",
    "settingId": "ambulant-nephrologie",
    "evidenceLevel": "direct",
    "population": "Resistente Hypertonie, häufig in Kardiologie, Nephrologie, Hypertensiologie oder Endokrinologie abgeklärt.",
    "probability": 0.2,
    "rangeLow": 0.1,
    "rangeHigh": 0.25,
    "rationale": "Für resistente Hypertonie wird PA häufig ungefähr bei 10-20% oder höher gefunden; spezialisierte Zuweisung erhöht die Prätestwahrscheinlichkeit.",
    "limitations": "Definition der resistenten Hypertonie, Medikamentenlage, Kaliumstatus, Aldosteron-Cut-off und Bestätigungstest verändern die Schätzung erheblich.",
    "lastReviewed": "2026-05-17",
    "sources": [
      {
        "title": "Primary aldosteronism: a common cause of resistant hypertension",
        "year": 2016,
        "url": "https://pmc.ncbi.nlm.nih.gov/articles/PMC5461126/",
        "kind": "Review",
        "note": "Review: PA bei resistenter Hypertonie häufig etwa 10-20%, in weniger selektierten Populationen niedriger."
      },
      {
        "title": "Endotext: Overview of Endocrine Hypertension",
        "year": 2026,
        "url": "https://www.ncbi.nlm.nih.gov/books/NBK278980/",
        "kind": "Lehrtext",
        "note": "Zusammenfassung endokriner Hypertonie: PA etwa 5-15% bei Hypertonie, höher bei therapieresistenter Hypertonie; PPGL selten."
      },
      {
        "title": "Study Heterogeneity and Estimation of Prevalence of Primary Aldosteronism",
        "year": 2016,
        "url": "https://academic.oup.com/jcem/article/101/7/2826/2810437",
        "kind": "Review",
        "note": "Systematischer Review: PA-Prävalenzschätzungen in Primärversorgung 3,2-12,7%, starke Heterogenität."
      }
    ],
    "kind": "curated",
    "reviewStatus": "needs-review",
    "evidenceQuality": "moderate",
    "dataCompleteness": "complete",
    "reviewNote": "Aktualisiert aus bereitgestellten Setting-Annahmen und Quellenabgleich; lokale Übertragbarkeit weiter fachlich prüfen."
  },
  {
    "id": "pa-general-fallback",
    "condition": "Primärer Hyperaldosteronismus",
    "conditionId": "primarer-hyperaldosteronismus",
    "setting": "Allgemeine Erkrankungsannahme",
    "settingId": "general",
    "evidenceLevel": "fallback",
    "population": "Patienten mit Hypertonie und klinischer Indikation zur Abklärung, ohne genaueres Setting.",
    "probability": 0.06,
    "rangeLow": 0.03,
    "rangeHigh": 0.12,
    "rationale": "Allgemeine Fallback-Annahme für Hypertonieabklärung. Monticone berichtete 3,9% bei Stadium 1, 5,9% insgesamt und 11,8% bei Stadium 3; daher mittlerer Wert für nicht näher spezifizierte Abklärung.",
    "limitations": "Bei unselektierter Primärversorgung niedriger, bei resistenter Hypertonie/Hypokaliämie höher. Stadium-1- und Stadium-3-Werte sind im Kommentar dokumentiert, aber aktuell nicht als eigene Setting-Auswahl modelliert.",
    "lastReviewed": "2026-05-17",
    "sources": [
      {
        "title": "Prevalence and Clinical Manifestations of Primary Aldosteronism Encountered in Primary Care Practice",
        "year": 2017,
        "url": "https://www.sciencedirect.com/science/article/pii/S0735109717305697",
        "kind": "Studie",
        "note": "1.672 primärversorgungsnahe Hypertoniepatienten; PA 5,9%, Stadium 1 3,9%, Stadium 3 11,8%."
      },
      {
        "title": "Study Heterogeneity and Estimation of Prevalence of Primary Aldosteronism",
        "year": 2016,
        "url": "https://academic.oup.com/jcem/article/101/7/2826/2810437",
        "kind": "Review",
        "note": "Systematischer Review: PA-Prävalenzschätzungen in Primärversorgung 3,2-12,7%, starke Heterogenität."
      }
    ],
    "kind": "curated",
    "reviewStatus": "needs-review",
    "evidenceQuality": "moderate",
    "dataCompleteness": "complete",
    "reviewNote": "Aktualisiert aus bereitgestellten Setting-Annahmen und Quellenabgleich; lokale Übertragbarkeit weiter fachlich prüfen."
  },
  {
    "id": "ppgl-primary-care-direct",
    "condition": "Phäochromozytom / Paragangliom",
    "conditionId": "phaochromozytom-paragangliom",
    "setting": "Hausarztpraxis",
    "settingId": "hausarztpraxis",
    "evidenceLevel": "direct",
    "population": "Unselektierte Hypertonie ohne typische Paroxysmen, Nebennierenraumforderung oder genetisches Risiko.",
    "probability": 0.003,
    "rangeLow": 0.002,
    "rangeHigh": 0.006,
    "rationale": "PPGL ist in unselektierten Hypertoniepopulationen selten. Diese niedrige Prätestwahrscheinlichkeit macht falsch-positive biochemische Befunde klinisch relevant.",
    "limitations": "Bei Nebenniereninzidentalom, genetischem Risiko, syndromalem Kontext oder klassischer Symptomatik höher ansetzen.",
    "lastReviewed": "2026-05-17",
    "sources": [
      {
        "title": "Pheochromocytoma: Symptom to Diagnosis, An Evidence-Based Guide",